{
  "rubric_version": "v1.7.0",
  "data_as_of": "2026-05-17T15:29:57Z",
  "generated_at": "2026-06-12T08:25:02Z",
  "series_window": {
    "from": "2026-05-16",
    "to": "2026-06-12"
  },
  "data": {
    "protocol_slug": "superstate",
    "series_window": {
      "from": "2026-05-16",
      "to": "2026-06-12"
    },
    "series": [
      {
        "snapshot_date": "2026-05-16",
        "rubric_version": "v1.7.0",
        "grade_letter": "D",
        "critical_count": 2,
        "red_count": 1,
        "yellow_count": 4,
        "gray_core_five": true
      },
      {
        "snapshot_date": "2026-06-12",
        "rubric_version": "v1.7.0",
        "grade_letter": "D",
        "critical_count": 2,
        "red_count": 1,
        "yellow_count": 4,
        "gray_core_five": true
      }
    ]
  }
}