{
  "rubric_version": "v1.7.0",
  "data_as_of": "2026-05-17T15:29:57Z",
  "generated_at": "2026-05-18T11:38:41Z",
  "series_window": {
    "from": "2026-05-16",
    "to": "2026-05-16"
  },
  "data": {
    "protocol_slug": "symbiotic",
    "series_window": {
      "from": "2026-05-16",
      "to": "2026-05-16"
    },
    "series": [
      {
        "snapshot_date": "2026-05-16",
        "rubric_version": "v1.7.0",
        "grade_letter": "B",
        "critical_count": 0,
        "red_count": 0,
        "yellow_count": 3,
        "gray_core_five": false
      }
    ]
  }
}