{
  "rubric_version": "v1.7.0",
  "data_as_of": "2026-05-17T15:29:57Z",
  "generated_at": "2026-06-12T08:15:55Z",
  "series_window": {
    "from": "2026-04-27",
    "to": "2026-06-12"
  },
  "data": {
    "protocol_slug": "synapse",
    "series_window": {
      "from": "2026-04-27",
      "to": "2026-06-12"
    },
    "series": [
      {
        "snapshot_date": "2026-04-27",
        "rubric_version": "v1.5.0",
        "grade_letter": "F",
        "critical_count": 7,
        "red_count": 9,
        "yellow_count": 4,
        "gray_core_five": false
      },
      {
        "snapshot_date": "2026-05-05",
        "rubric_version": "v1.6.0",
        "grade_letter": "F",
        "critical_count": 7,
        "red_count": 9,
        "yellow_count": 4,
        "gray_core_five": false
      },
      {
        "snapshot_date": "2026-05-06",
        "rubric_version": "v1.6.0",
        "grade_letter": "F",
        "critical_count": 7,
        "red_count": 9,
        "yellow_count": 4,
        "gray_core_five": false
      },
      {
        "snapshot_date": "2026-05-11",
        "rubric_version": "v1.6.0",
        "grade_letter": "F",
        "critical_count": 7,
        "red_count": 9,
        "yellow_count": 4,
        "gray_core_five": false
      },
      {
        "snapshot_date": "2026-05-12",
        "rubric_version": "v1.7.0",
        "grade_letter": "F",
        "critical_count": 7,
        "red_count": 6,
        "yellow_count": 6,
        "gray_core_five": false
      },
      {
        "snapshot_date": "2026-06-12",
        "rubric_version": "v1.7.0",
        "grade_letter": "F",
        "critical_count": 7,
        "red_count": 6,
        "yellow_count": 6,
        "gray_core_five": false
      }
    ]
  }
}