{
  "rubric_version": "v1.6.0",
  "data_as_of": "2026-05-12T04:06:37Z",
  "generated_at": "2026-05-12T04:06:40Z",
  "series_window": {
    "from": "2026-04-28",
    "to": "2026-05-11"
  },
  "data": {
    "protocol_slug": "ether-fi",
    "series_window": {
      "from": "2026-04-28",
      "to": "2026-05-11"
    },
    "series": [
      {
        "snapshot_date": "2026-04-28",
        "rubric_version": "v1.5.0",
        "grade_letter": "C",
        "critical_count": 0,
        "red_count": 1,
        "yellow_count": 12,
        "gray_core_five": false
      },
      {
        "snapshot_date": "2026-05-05",
        "rubric_version": "v1.6.0",
        "grade_letter": "C",
        "critical_count": 0,
        "red_count": 1,
        "yellow_count": 12,
        "gray_core_five": false
      },
      {
        "snapshot_date": "2026-05-06",
        "rubric_version": "v1.6.0",
        "grade_letter": "C",
        "critical_count": 0,
        "red_count": 1,
        "yellow_count": 12,
        "gray_core_five": false
      },
      {
        "snapshot_date": "2026-05-11",
        "rubric_version": "v1.6.0",
        "grade_letter": "C",
        "critical_count": 0,
        "red_count": 1,
        "yellow_count": 12,
        "gray_core_five": false
      }
    ]
  }
}