{
  "rubric_version": "v1.5.0",
  "data_as_of": "2026-05-04T19:56:06Z",
  "generated_at": "2026-05-04T19:56:07Z",
  "series_window": {
    "from": "2026-04-27",
    "to": "2026-04-27"
  },
  "data": {
    "protocol_slug": "spark",
    "series_window": {
      "from": "2026-04-27",
      "to": "2026-04-27"
    },
    "series": [
      {
        "snapshot_date": "2026-04-27",
        "rubric_version": "v1.5.0",
        "grade_letter": "F",
        "badge": "CLEAN",
        "critical_count": 0,
        "red_count": 4,
        "yellow_count": 9,
        "gray_core_five": false
      }
    ]
  }
}