{
  "rubric_version": "v1.7.0",
  "data_as_of": "2026-07-05T19:18:15Z",
  "generated_at": "2026-07-05T19:18:17Z",
  "series_window": {
    "from": "2026-06-25",
    "to": "2026-07-05"
  },
  "data": {
    "protocol_slug": "hastra",
    "series_window": {
      "from": "2026-06-25",
      "to": "2026-07-05"
    },
    "series": [
      {
        "snapshot_date": "2026-06-25",
        "rubric_version": "v1.7.0",
        "grade_letter": "F",
        "critical_count": 3,
        "red_count": 1,
        "yellow_count": 5,
        "gray_core_five": true
      },
      {
        "snapshot_date": "2026-07-05",
        "rubric_version": "v1.7.0",
        "grade_letter": "F",
        "critical_count": 3,
        "red_count": 1,
        "yellow_count": 5,
        "gray_core_five": true
      }
    ]
  }
}