{
  "rubric_version": "v1.7.0",
  "data_as_of": "2026-05-17T15:29:57Z",
  "generated_at": "2026-05-18T11:38:41Z",
  "series_window": {
    "from": "2026-04-27",
    "to": "2026-05-12"
  },
  "data": {
    "protocol_slug": "across-protocol",
    "series_window": {
      "from": "2026-04-27",
      "to": "2026-05-12"
    },
    "series": [
      {
        "snapshot_date": "2026-04-27",
        "rubric_version": "v1.5.0",
        "grade_letter": "F",
        "critical_count": 2,
        "red_count": 3,
        "yellow_count": 8,
        "gray_core_five": false
      },
      {
        "snapshot_date": "2026-04-28",
        "rubric_version": "v1.5.0",
        "grade_letter": "D",
        "critical_count": 1,
        "red_count": 2,
        "yellow_count": 3,
        "gray_core_five": true
      },
      {
        "snapshot_date": "2026-04-30",
        "rubric_version": "v1.5.0",
        "grade_letter": "D",
        "critical_count": 1,
        "red_count": 2,
        "yellow_count": 5,
        "gray_core_five": true
      },
      {
        "snapshot_date": "2026-05-05",
        "rubric_version": "v1.6.0",
        "grade_letter": "D",
        "critical_count": 1,
        "red_count": 2,
        "yellow_count": 5,
        "gray_core_five": true
      },
      {
        "snapshot_date": "2026-05-06",
        "rubric_version": "v1.6.0",
        "grade_letter": "D",
        "critical_count": 1,
        "red_count": 2,
        "yellow_count": 5,
        "gray_core_five": true
      },
      {
        "snapshot_date": "2026-05-11",
        "rubric_version": "v1.6.0",
        "grade_letter": "D",
        "critical_count": 1,
        "red_count": 2,
        "yellow_count": 5,
        "gray_core_five": true
      },
      {
        "snapshot_date": "2026-05-12",
        "rubric_version": "v1.7.0",
        "grade_letter": "C",
        "critical_count": 1,
        "red_count": 1,
        "yellow_count": 3,
        "gray_core_five": true
      }
    ]
  }
}