{
  "data": {
    "protocol_slug": "venus",
    "series": [
      {
        "cap_applied": "none",
        "critical_count": 1,
        "grade_letter": "C",
        "risk_score": 31.07,
        "rubric_version": "v1.7.0",
        "snapshot_date": "2026-07-24",
        "snapshot_version": "adopt-existing:venus:2026-07-24"
      }
    ],
    "series_window": {
      "from": "2026-07-24",
      "to": "2026-07-24"
    }
  },
  "data_as_of": "2026-07-24T00:00:00Z",
  "generated_at": "2026-08-07T00:00:00Z",
  "rubric_version": "v1.7.0",
  "series_window": {
    "from": "2026-07-24",
    "to": "2026-07-24"
  }
}
